{
    "operators": 2,
    "boxes": [
        {
            "box": "A",
            "size": "S"
        },
        {
            "box": "B",
            "size": "S"
        },
        {
            "box": "C",
            "size": "S"
        },
        {
            "box": "D",
            "size": "M"
        },
        {
            "box": "E",
            "size": "M"
        },
        {
            "box": "F",
            "size": "L"
        }
    ],
    "drawers": {
        "upper_level": [
            {
                "drawer": 1,
                "size": "S"
            },
            {
                "drawer": 2,
                "size": "S"
            },
            {
                "drawer": 3,
                "size": "S"
            },
            {
                "drawer": 4,
                "size": "S"
            },
            {
                "drawer": 5,
                "size": "M"
            },
            {
                "drawer": 6,
                "size": "M"
            },
            {
                "drawer": 7,
                "size": "M"
            }
        ],
        "lower_level": [
            {
                "drawer": 8,
                "size": "L"
            },
            {
                "drawer": 9,
                "size": "L"
            },
            {
                "drawer": 10,
                "size": "L"
            },
            {
                "drawer": 11,
                "size": "L"
            }
        ]
    },
    "drawer_capacities": [
        {
            "box": "A",
            "capacity": 50
        },
        {
            "box": "B",
            "capacity": 50
        },
        {
            "box": "C",
            "capacity": 50
        },
        {
            "box": "D",
            "capacity": 50
        },
        {
            "box": "E",
            "capacity": 50
        },
        {
            "box": "F",
            "capacity": 50
        }
    ],
    "box_constructions_per_replenishment": 10,
    "minimum_remaining_boxes": 2,
    "box_filling_durations": [
        {
            "box": "A",
            "filling_duration": 15
        },
        {
            "box": "B",
            "filling_duration": 15
        },
        {
            "box": "C",
            "filling_duration": 15
        },
        {
            "box": "D",
            "filling_duration": 15
        },
        {
            "box": "E",
            "filling_duration": 15
        },
        {
            "box": "F",
            "filling_duration": 15
        }
    ],
    "orders": {
        "date": [
            "2025-09-19",
            "2025-09-19",
            "2025-09-19",
            "2025-09-19",
            "2025-09-19",
            "2025-09-19",
            "2025-09-19",
            "2025-09-19",
            "2025-09-19",
            "2025-09-19",
            "2025-09-19",
            "2025-09-19",
            "2025-09-19",
            "2025-09-19",
            "2025-09-19",
            "2025-09-19",
            "2025-09-19",
            "2025-09-19",
            "2025-09-19",
            "2025-09-19",
            "2025-09-19",
            "2025-09-19",
            "2025-09-19",
            "2025-09-19",
            "2025-09-19",
            "2025-09-19",
            "2025-09-19",
            "2025-09-19",
            "2025-09-19",
            "2025-09-19",
            "2025-09-19",
            "2025-09-19",
            "2025-09-19",
            "2025-09-19",
            "2025-09-19",
            "2025-09-19",
            "2025-09-19",
            "2025-09-19",
            "2025-09-19",
            "2025-09-19",
            "2025-09-19",
            "2025-09-19",
            "2025-09-19",
            "2025-09-19",
            "2025-09-19",
            "2025-09-19",
            "2025-09-19",
            "2025-09-19",
            "2025-09-19",
            "2025-09-19",
            "2025-09-19",
            "2025-09-19",
            "2025-09-19",
            "2025-09-19",
            "2025-09-19",
            "2025-09-19",
            "2025-09-19",
            "2025-09-19",
            "2025-09-19",
            "2025-09-19",
            "2025-09-19",
            "2025-09-19",
            "2025-09-19",
            "2025-09-19",
            "2025-09-19",
            "2025-09-19",
            "2025-09-19",
            "2025-09-19",
            "2025-09-19",
            "2025-09-19",
            "2025-09-19",
            "2025-09-19",
            "2025-09-19",
            "2025-09-19",
            "2025-09-19",
            "2025-09-19",
            "2025-09-19",
            "2025-09-19",
            "2025-09-19",
            "2025-09-19",
            "2025-09-19",
            "2025-09-19",
            "2025-09-19",
            "2025-09-19",
            "2025-09-19",
            "2025-09-19",
            "2025-09-19",
            "2025-09-19",
            "2025-09-19",
            "2025-09-19",
            "2025-09-19",
            "2025-09-19",
            "2025-09-19",
            "2025-09-19",
            "2025-09-19",
            "2025-09-19",
            "2025-09-19",
            "2025-09-19",
            "2025-09-19",
            "2025-09-19",
            "2025-09-19",
            "2025-09-19",
            "2025-09-19",
            "2025-09-19",
            "2025-09-19",
            "2025-09-19",
            "2025-09-19",
            "2025-09-19",
            "2025-09-19",
            "2025-09-19",
            "2025-09-19",
            "2025-09-19",
            "2025-09-19",
            "2025-09-19",
            "2025-09-19",
            "2025-09-19",
            "2025-09-19",
            "2025-09-19",
            "2025-09-19",
            "2025-09-19",
            "2025-09-19",
            "2025-09-19",
            "2025-09-19",
            "2025-09-19",
            "2025-09-19",
            "2025-09-19",
            "2025-09-19",
            "2025-09-19",
            "2025-09-19",
            "2025-09-19",
            "2025-09-19",
            "2025-09-19",
            "2025-09-19",
            "2025-09-19",
            "2025-09-19",
            "2025-09-19",
            "2025-09-19",
            "2025-09-19",
            "2025-09-19",
            "2025-09-19",
            "2025-09-19",
            "2025-09-19",
            "2025-09-19",
            "2025-09-19",
            "2025-09-19",
            "2025-09-19",
            "2025-09-19",
            "2025-09-19",
            "2025-09-19",
            "2025-09-19",
            "2025-09-19",
            "2025-09-19",
            "2025-09-19",
            "2025-09-19",
            "2025-09-19",
            "2025-09-19",
            "2025-09-19",
            "2025-09-19",
            "2025-09-19",
            "2025-09-19",
            "2025-09-19",
            "2025-09-19",
            "2025-09-19",
            "2025-09-19",
            "2025-09-19",
            "2025-09-19",
            "2025-09-19",
            "2025-09-19",
            "2025-09-19",
            "2025-09-19",
            "2025-09-19",
            "2025-09-19",
            "2025-09-19",
            "2025-09-19",
            "2025-09-19",
            "2025-09-19",
            "2025-09-19",
            "2025-09-19",
            "2025-09-19",
            "2025-09-19",
            "2025-09-19",
            "2025-09-19",
            "2025-09-19",
            "2025-09-19",
            "2025-09-19",
            "2025-09-19",
            "2025-09-19",
            "2025-09-19",
            "2025-09-19",
            "2025-09-19",
            "2025-09-19",
            "2025-09-19",
            "2025-09-19",
            "2025-09-19",
            "2025-09-19",
            "2025-09-19",
            "2025-09-19",
            "2025-09-19",
            "2025-09-19",
            "2025-09-19",
            "2025-09-19",
            "2025-09-19",
            "2025-09-19",
            "2025-09-19",
            "2025-09-19",
            "2025-09-19",
            "2025-09-19",
            "2025-09-19",
            "2025-09-19",
            "2025-09-19",
            "2025-09-19",
            "2025-09-19",
            "2025-09-19",
            "2025-09-19",
            "2025-09-19",
            "2025-09-19",
            "2025-09-19",
            "2025-09-19",
            "2025-09-19",
            "2025-09-19",
            "2025-09-19",
            "2025-09-19",
            "2025-09-19",
            "2025-09-19",
            "2025-09-19",
            "2025-09-19",
            "2025-09-19",
            "2025-09-19",
            "2025-09-19",
            "2025-09-19",
            "2025-09-19",
            "2025-09-19",
            "2025-09-19",
            "2025-09-19",
            "2025-09-19",
            "2025-09-19",
            "2025-09-19",
            "2025-09-19",
            "2025-09-19",
            "2025-09-19",
            "2025-09-19",
            "2025-09-19",
            "2025-09-19",
            "2025-09-19",
            "2025-09-19",
            "2025-09-19",
            "2025-09-19",
            "2025-09-19",
            "2025-09-19",
            "2025-09-19",
            "2025-09-19",
            "2025-09-19",
            "2025-09-19",
            "2025-09-19",
            "2025-09-19",
            "2025-09-19",
            "2025-09-19",
            "2025-09-19",
            "2025-09-19",
            "2025-09-19",
            "2025-09-19",
            "2025-09-19",
            "2025-09-19",
            "2025-09-19",
            "2025-09-19",
            "2025-09-19",
            "2025-09-19",
            "2025-09-19",
            "2025-09-19",
            "2025-09-19",
            "2025-09-19",
            "2025-09-19",
            "2025-09-19",
            "2025-09-19",
            "2025-09-19",
            "2025-09-19",
            "2025-09-19",
            "2025-09-19",
            "2025-09-19",
            "2025-09-19",
            "2025-09-19",
            "2025-09-19",
            "2025-09-19",
            "2025-09-19",